{
  "schema_version": "1.0.0",
  "suite_id": "vertical_slice_scenarios_v1",
  "purpose": "engineering_regression_only",
  "content_pack_version": "v1",
  "scenarios": [
    {
      "scenario_id": "scenario_01_no_recent_score",
      "category": "normal",
      "title": "无最近成绩完成首次体验",
      "preconditions": ["Synthetic learner has no recent exam score", "Content pack v1 is eligible_dev"],
      "input": { "actor": "learner", "command": "complete_first_experience", "fixture_refs": ["calibration_reading_a_v1", "calibration_reading_b_v1"], "parameters": { "exam_track": "english_1" } },
      "expected_domain_facts": ["Profile snapshot records missing score as unknown", "Initial confidence remains low", "A conservative matched task is assigned"],
      "expected_events": ["profile_minimum_submitted", "calibration_completed", "matched_task_assigned"],
      "public_error": null,
      "expected_audit": ["Assignment records snapshot and content versions"],
      "forbidden_side_effects": ["Do not invent a score", "Do not label ability calibrated"]
    },
    {
      "scenario_id": "scenario_02_english_one_standard",
      "category": "normal",
      "title": "英一用户完成标准校准和匹配",
      "preconditions": ["Synthetic learner selects english_1", "No prior material exposure"],
      "input": { "actor": "learner", "command": "complete_standard_slice", "fixture_refs": ["calibration_reading_a_v1", "matched_reading_01_v1"] },
      "expected_domain_facts": ["Exam track remains english_1", "Independent attempt precedes feedback", "Task reaches completed state"],
      "expected_events": ["calibration_completed", "independent_attempt_saved", "task_completed"],
      "public_error": null,
      "expected_audit": ["All task transitions reference immutable versions"],
      "forbidden_side_effects": ["Do not expose english_2-only configuration", "Do not overwrite V1"]
    },
    {
      "scenario_id": "scenario_03_english_two_standard",
      "category": "normal",
      "title": "英二用户完成标准校准和匹配",
      "preconditions": ["Synthetic learner selects english_2", "No prior material exposure"],
      "input": { "actor": "learner", "command": "complete_standard_slice", "fixture_refs": ["calibration_reading_a_v1", "matched_reading_02_v1"] },
      "expected_domain_facts": ["Exam track remains english_2", "Independent attempt precedes feedback", "Task reaches completed state"],
      "expected_events": ["calibration_completed", "independent_attempt_saved", "task_completed"],
      "public_error": null,
      "expected_audit": ["Assignment records english_2 configuration version"],
      "forbidden_side_effects": ["Do not expose english_1-only configuration", "Do not claim score prediction"]
    },
    {
      "scenario_id": "scenario_04_independent_completion",
      "category": "normal",
      "title": "不使用提示完成解释和微型表达",
      "preconditions": ["Matched reading is open", "Hint level is H0"],
      "input": { "actor": "learner", "command": "submit_independent_outputs", "fixture_refs": ["matched_reading_01_v1", "micro_expression_01_v1"] },
      "expected_domain_facts": ["Attempts are marked independent", "Highest hint level remains zero", "Completion is evidence of this task only"],
      "expected_events": ["independent_attempt_saved", "micro_expression_v1_saved", "task_completed"],
      "public_error": null,
      "expected_audit": ["Audit records no model intervention"],
      "forbidden_side_effects": ["Do not infer stable mastery", "Do not create a hidden AI rewrite"]
    },
    {
      "scenario_id": "scenario_05_h2_revision",
      "category": "normal",
      "title": "使用 H2 后重新输出并保存 V2",
      "preconditions": ["Independent V1 exists", "H1 did not resolve the priority issue"],
      "input": { "actor": "learner", "command": "request_h2_and_revise", "fixture_refs": ["matched_reading_01_v1", "micro_expression_01_v1"] },
      "expected_domain_facts": ["V1 remains immutable", "One H2 intervention references V1", "V2 is learner-authored and marked hinted_low"],
      "expected_events": ["hint_requested", "ai_intervention_delivered", "revision_saved"],
      "public_error": null,
      "expected_audit": ["Intervention, prompt and model adapter versions are recorded"],
      "forbidden_side_effects": ["Do not replace V1", "Do not generate the full V2 for the learner"]
    },
    {
      "scenario_id": "scenario_06_material_seen",
      "category": "boundary",
      "title": "用户报告材料见过并获得替换材料",
      "preconditions": ["Matched reading 01 is assigned", "Replacement reading 02 is eligible_dev"],
      "input": { "actor": "learner", "command": "report_material_seen", "fixture_refs": ["matched_reading_01_v1", "matched_reading_02_v1"] },
      "expected_domain_facts": ["Seen material is excluded from independent evidence", "Replacement uses the same learner snapshot", "Original assignment remains auditable"],
      "expected_events": ["material_seen_reported", "material_replaced"],
      "public_error": null,
      "expected_audit": ["Replacement reason and both content versions are recorded"],
      "forbidden_side_effects": ["Do not delete the original assignment", "Do not count seen performance as unseen evidence"]
    },
    {
      "scenario_id": "scenario_07_conflicting_profile",
      "category": "boundary",
      "title": "画像证据冲突时保守匹配",
      "preconditions": ["Self-report and task evidence conflict", "Profile confidence is low"],
      "input": { "actor": "system", "command": "assign_matched_material", "fixture_refs": ["calibration_reading_a_v1", "matched_reading_01_v1"] },
      "expected_domain_facts": ["Conflict remains explicit", "Lower-risk material is selected", "Profile is not silently averaged into false precision"],
      "expected_events": ["profile_conflict_detected", "conservative_match_applied"],
      "public_error": null,
      "expected_audit": ["Matching reason code points to conflicting evidence"],
      "forbidden_side_effects": ["Do not write a calibrated theta", "Do not discard contradictory evidence"]
    },
    {
      "scenario_id": "scenario_08_duplicate_command",
      "category": "boundary",
      "title": "重复提交同一幂等命令",
      "preconditions": ["A valid save command has completed", "Idempotency key is retained"],
      "input": { "actor": "learner", "command": "repeat_save_attempt", "fixture_refs": ["matched_reading_01_v1"], "parameters": { "same_idempotency_key": true } },
      "expected_domain_facts": ["Only one attempt version exists", "Both responses identify the same business fact"],
      "expected_events": ["attempt_saved", "duplicate_command_replayed"],
      "public_error": null,
      "expected_audit": ["Replay is distinguishable from a new mutation"],
      "forbidden_side_effects": ["Do not create a second attempt", "Do not make a second remote model call"]
    },
    {
      "scenario_id": "scenario_09_event_reordering",
      "category": "boundary",
      "title": "客户端事件乱序和重复到达",
      "preconditions": ["Analytics events carry event_id and occurred_at", "Business facts are server authoritative"],
      "input": { "actor": "system", "command": "ingest_out_of_order_events", "fixture_refs": ["first_experience_events_v1"] },
      "expected_domain_facts": ["Business task state is unchanged", "Duplicate analytics event is deduplicated", "Occurrence order remains reconstructable"],
      "expected_events": ["analytics_event_ingested", "analytics_duplicate_dropped"],
      "public_error": null,
      "expected_audit": ["Ingestion records received and occurred timestamps"],
      "forbidden_side_effects": ["Do not drive task completion from client analytics", "Do not count a duplicate twice"]
    },
    {
      "scenario_id": "scenario_10_ime_autosave",
      "category": "boundary",
      "title": "中文输入法组合态遇到自动保存和快捷键",
      "preconditions": ["Desktop editor is composing Chinese input", "Autosave deadline occurs"],
      "input": { "actor": "learner", "command": "compose_and_autosave", "fixture_refs": ["micro_expression_01_v1"], "parameters": { "is_composing": true } },
      "expected_domain_facts": ["Committed text remains intact", "Shortcut does not submit during composition", "Autosave resumes after composition ends"],
      "expected_events": ["draft_autosave_deferred", "draft_saved"],
      "public_error": null,
      "expected_audit": ["No raw composition text is written to ordinary logs"],
      "forbidden_side_effects": ["Do not truncate text", "Do not submit an incomplete composition"]
    },
    {
      "scenario_id": "scenario_11_annotation_history",
      "category": "boundary",
      "title": "重叠标记、撤销重做和旧 Schema 文档",
      "preconditions": ["Document contains overlapping semantic annotations", "Saved draft uses a supported older schema"],
      "input": { "actor": "learner", "command": "edit_annotation_history", "fixture_refs": ["matched_reading_01_v1"] },
      "expected_domain_facts": ["Overlaps preserve distinct annotation IDs", "Undo and redo are deterministic", "Old document is migrated without changing source spans"],
      "expected_events": ["annotation_created", "annotation_undone", "annotation_redone", "editor_schema_migrated"],
      "public_error": null,
      "expected_audit": ["Migration version is recorded"],
      "forbidden_side_effects": ["Do not merge different semantic intents", "Do not shift evidence spans silently"]
    },
    {
      "scenario_id": "scenario_12_keyboard_zoom",
      "category": "boundary",
      "title": "200% 缩放下只用键盘完成任务",
      "preconditions": ["Desktop viewport is at least 1280 by 720", "Browser zoom is 200 percent"],
      "input": { "actor": "learner", "command": "complete_slice_keyboard_only", "fixture_refs": ["calibration_reading_a_v1", "micro_expression_01_v1"] },
      "expected_domain_facts": ["All required actions remain reachable", "Focus order follows task order", "No content is lost behind fixed panels"],
      "expected_events": ["task_completed"],
      "public_error": null,